{
  "task_id": "task-smoke-003",
  "risk_level": "LOW",
  "produced_by": {
    "actor_id": "dev",
    "actor_type": "agent"
  },
  "implemented_by": {
    "actor_id": "dev",
    "actor_type": "agent"
  },
  "verified_by": {
    "actor_id": "dev",
    "actor_type": "agent"
  },
  "final_verifier": "dev"
}